product_id,product_name,product_regime_tag,jurisdiction_code,jurisdiction_name,region,regulation_name,regulation_ref,enforcement_body,key_requirements,status,criticality,legal_api_match,legal_api_id,legal_api_match_method,gap_action,notes
"7","Capsule lessive (pod)","Détergent + biocide","TR","Turkey","Eastern Europe & Central Asia","Turkish CLP equivalent — chemical labeling","Turkish Chemicals Legislation (aligned with EU REACH/CLP via Customs Union)","ÇSGB (Ministry of Labour) + Çevre Bakanlığı","GHS-based classification and labeling aligned with EU CLP via Customs Union agreement; Turkish SDS; hazard communication in Turkish; child safety warnings","in_force","medium","","","","","TR aligns with EU CLP via Customs Union; Turkish language SDS and labeling required"
"7","Capsule lessive (pod)","Détergent + biocide","ISO","ISO/IEC","International","ISO 14001 — Environmental Management System","ISO 14001:2015","ISO / Accreditation bodies","Environmental management system standard; voluntary certification; relevant for manufacturing operations; supports eco-credentials and regulatory compliance across all markets; demonstrates environmental commitment","in_force","low","","","","","ISO 14001 voluntary EMS standard; supports market access in EU/AU/CA with eco-procurement requirements"
"7","Capsule lessive (pod)","Détergent + biocide","ISO","ISO/IEC","International","ISO 9001 — Quality Management System","ISO 9001:2015","ISO / Accreditation bodies","Quality management system; voluntary; supports product consistency and regulatory compliance globally; often required by retailer and procurement frameworks; relevant for pod manufacturing quality control","in_force","low","","","","","ISO 9001 voluntary QMS; commercially expected by major retailers globally"
7,Capsule lessive (pod),Détergent + biocide,IT,Italy,Europe,EU Detergents Regulation — directly applicable in Italy,Regulation (EC) 648/2004 + Regulation (EU) 2026/405,Ministero della Salute / ISPRA,EU regulation directly applicable in Italy; surfactant biodegradability; labeling in Italian; SDS; pods must include child-safety warnings; REACH/CLP obligations apply,in_force,critical,,,,,EU regulation directly applicable in IT; Italian labeling language required per Annex VII
7,Capsule lessive (pod),Détergent + biocide,IT,Italy,Europe,REACH Regulation — Italy enforcement,Regulation (EC) 1907/2006,Ministero della Salute / ISPRA,Registration and restriction of chemical substances; SVHC communication; pods contain surfactants subject to REACH registration; no separate Italian national law,in_force,high,,,,,Italy enforces REACH via national competent authority; no additional national rules
7,Capsule lessive (pod),Détergent + biocide,ES,Spain,Europe,EU Detergents Regulation — directly applicable in Spain,Regulation (EC) 648/2004 + Regulation (EU) 2026/405,Ministerio de Sanidad / AEMPS,EU regulation directly applicable in Spain; labeling in Spanish mandatory; surfactant biodegradability; ingredient disclosure; SDS; child-safety closure required for pods,in_force,critical,,,,,EU regulation directly applicable in ES; Spanish labeling language required
7,Capsule lessive (pod),Détergent + biocide,ES,Spain,Europe,CLP Regulation — Spain enforcement,Regulation (EC) 1272/2008,Ministerio de Sanidad / AEMPS,GHS classification and labeling; UFI mandatory; Spanish-language hazard statements; pods classified as hazardous; child-resistant packaging mandatory,in_force,high,,,,,Spain enforces CLP nationally; pods must meet child-resistant packaging Regulation (EU) 2023/1642
7,Capsule lessive (pod),Détergent + biocide,NL,Netherlands,Europe,EU Detergents Regulation — directly applicable in NL,Regulation (EC) 648/2004 + Regulation (EU) 2026/405,RIVM / Inspectie Leefomgeving en Transport,EU regulation directly applicable in Netherlands; Dutch labeling language required; surfactant biodegradability; ingredient disclosure; SDS; child-safety closure for pods,in_force,critical,,,,,EU regulation directly applicable in NL; Dutch labeling required; RIVM active enforcer
7,Capsule lessive (pod),Détergent + biocide,NL,Netherlands,Europe,REACH — NL national enforcement,Regulation (EC) 1907/2006,RIVM,REACH substance registration; SVHC communication; no additional NL national chemicals law for detergents,in_force,high,,,,,Netherlands among strictest REACH enforcers; monitor Dutch RIVM guidance
7,Capsule lessive (pod),Détergent + biocide,UA,Ukraine,Europe,Ukrainian Chemical Safety Law — Chemicals,Law of Ukraine No. 2664-VI (Chemical Safety),State Service of Ukraine on Food Safety and Consumer Protection (SSUFSCP),Registration of hazardous chemicals; labeling in Ukrainian; SDS in Ukrainian; pods classified as hazardous household chemicals; notification required,in_force,high,,,,,Ukraine not in EU; own chemicals framework; Cabinet of Ministers Resolution 1156 on dangerous substances labeling
7,Capsule lessive (pod),Détergent + biocide,UA,Ukraine,Europe,Ukraine Technical Regulation on Household Chemicals,Resolution of Cabinet of Ministers of Ukraine No. 156 (2013),SSUFSCP,Conformity assessment for household chemical products; labeling requirements; composition disclosure; Ukrainian language mandatory on packaging,in_force,critical,,,,,Primary UA regulation for detergent pods; requires Ukrainian-language full label
7,Capsule lessive (pod),Détergent + biocide,HK,Hong Kong,Asia-Pacific,Public Health and Municipal Services Ordinance (Cap. 132),Cap. 132 — PHMSO,Food and Environmental Hygiene Department (FEHD) / Customs and Excise,Household chemical products must be safe for use; labeling in Chinese (Traditional) and English; no specific pod regulation but general consumer safety applies; import notification for hazardous chemicals,in_force,medium,,,,,HK has no standalone detergent regulation; PHMSO + general consumer safety law applies
7,Capsule lessive (pod),Détergent + biocide,HK,Hong Kong,Asia-Pacific,Chemical Weapons (Convention) Implementation Ordinance — export controls,Cap. 578,Hong Kong Customs and Excise Department,Certain chemical precursors subject to export control; applicable to supply chain documentation for pod ingredients,in_force,low,,,,,Precautionary: verify no scheduled chemicals in pod formula per Cap. 578 schedules
7,Capsule lessive (pod),Détergent + biocide,TW,Taiwan,Asia-Pacific,Toxic and Chemical Substances Control Act (TCSCA),TFDA / EPA (Taiwan),MOENV (formerly EPA) / TFDA,Registration of toxic chemical substances; hazard classification; labeling in Traditional Chinese; SDS; pods may contain substances on TCSCA list; manufacturer/importer registration required,in_force,high,,,,,Taiwan has standalone toxic chemicals act; verify surfactants and biocide ingredients vs Schedule 1/2/3 lists
7,Capsule lessive (pod),Détergent + biocide,TW,Taiwan,Asia-Pacific,Consumer Protection Act — labeling requirements,Consumer Protection Act (消費者保護法),Executive Yuan / MOEA,Chinese-language labeling mandatory; ingredient disclosure for hazardous products; origin marking; net quantity; importer contact,in_force,medium,,,,,Labeling in Traditional Chinese required; pods must include child-safety warnings under TFDA guidance
7,Capsule lessive (pod),Détergent + biocide,SG,Singapore,Asia-Pacific,Environmental Protection and Management Act (EPMA) — Hazardous Substances,Environmental Protection and Management Act (Cap. 94A),National Environment Agency (NEA),Schedule 1 hazardous substances registration; import/export license; SDS required; pods may contain controlled surfactants or biocides requiring NEA registration,in_force,high,,,,,SG requires NEA license for hazardous substances; verify pod ingredients vs EPMA Schedule 1
7,Capsule lessive (pod),Détergent + biocide,SG,Singapore,Asia-Pacific,Consumer Protection (Safety Requirements) Regulations,CPSR — Gazette,Enterprise Singapore / SAFETY Mark,Consumer goods safety; no specific pod standard under CPSR currently but general safety obligation applies,in_force,medium,,,,,CPSR covers listed consumer goods; detergent pods not currently listed but monitor for additions
7,Capsule lessive (pod),Détergent + biocide,MY,Malaysia,Asia-Pacific,Environmental Quality Act 1974 (EQA) — Scheduled Wastes,EQA 1974 + Scheduled Wastes Regulations 2005,Department of Environment (DOE) Malaysia,Classification of hazardous chemical waste; SDS; pods ingredients that are scheduled wastes must be managed per SW regulations; importer registration,in_force,medium,,,,,Malaysia: EQA covers chemicals disposal; no standalone detergent law; consumer protection via Trade Descriptions Act
7,Capsule lessive (pod),Détergent + biocide,MY,Malaysia,Asia-Pacific,Control of Industrial Major Accident Hazards (CIMAH) Regulations + Trade Descriptions Act,Trade Descriptions Act 2011 / CIMAH 1996,Ministry of Domestic Trade and Cost of Living / DOSH,Labeling accuracy; Malay and English labeling acceptable; ingredient disclosure; false/misleading claims prohibited; CIMAH applies if manufacturing site,in_force,medium,,,,,Malay-language labeling required for domestic market; pods must disclose active ingredients
7,Capsule lessive (pod),Détergent + biocide,TH,Thailand,Asia-Pacific,Hazardous Substances Act B.E. 2535 (1992),HSA 1992 — Type 2/3 controlled substances,Food and Drug Administration Thailand (Thai FDA) / Industrial Works Dept,Registration of hazardous household chemicals; pods likely Type 2 or 3 hazardous substance; labeling in Thai; SDS; registration number on packaging,in_force,high,,,,,Thai HSA is primary framework; pods with biocide component require Type 3 registration with Thai FDA
7,Capsule lessive (pod),Détergent + biocide,VN,Vietnam,Asia-Pacific,Decree 113/2017/ND-CP on Chemicals,Decree 113/2017/ND-CP,Ministry of Industry and Trade (MOIT) Vietnam,Chemical declaration; classification and labeling in Vietnamese; SDS in Vietnamese; hazardous household chemicals subject to declaration and annual reporting; pods require compliance with Annex labeling,in_force,high,,,,,Vietnam: Decree 113 is primary chemicals law; pods classified as hazardous household chemical; declaration to MOIT required
7,Capsule lessive (pod),Détergent + biocide,ID,Indonesia,Asia-Pacific,Regulation of Minister of Trade (Permendag) on Product Labeling,Permendag No. 36/2023 (and predecessors),Ministry of Trade (Kemendag) / BPOM,Indonesian-language labeling mandatory; ingredient disclosure; net content; origin; importer info; halal certification if marketed as halal; pods with chemical ingredients may require BPOM notification,in_force,high,,,,,Indonesia: Bahasa Indonesia labeling mandatory; BPOM involved for household chemicals; halal logo if claimed
7,Capsule lessive (pod),Détergent + biocide,ID,Indonesia,Asia-Pacific,Government Regulation on Management of Hazardous Substances (B3),PP No. 74/2001 on Management of Hazardous and Toxic Materials,Ministry of Environment and Forestry (KLHK),B3 registration for hazardous chemicals; SDS; transport labeling; detergent pods with biocide classified as B3 household hazardous waste,in_force,medium,,,,,B3 regulation applies to end-of-life and transport; importer must register hazardous substances
7,Capsule lessive (pod),Détergent + biocide,PH,Philippines,Asia-Pacific,RA 6969 — Toxic Substances and Hazardous and Nuclear Wastes Control Act,Republic Act No. 6969 / DENR DAO 29 Series 1992,Department of Environment and Natural Resources (DENR) — EMB,Chemical registration under Priority Chemical List (PCL); SDS; labeling; pods with biocide/surfactant may be PCL-listed; importer chemical registration required,in_force,high,,,,,RA 6969 is primary PH chemicals law; DENR EMB administers PCL; pods require pre-importation clearance if PCL substance
7,Capsule lessive (pod),Détergent + biocide,ASEAN,ASEAN,Asia-Pacific,ASEAN Harmonized Regulatory Framework for Household Hazardous Chemicals,ASEAN Sectoral MRA — Chemical Sector (Household Chemicals Annex),ASEAN Secretariat / national competent authorities,Mutual recognition principles for conformity assessment; SDS harmonization across ASEAN; GHS-aligned labeling; member states apply national regulations but MRA facilitates market access,in_force,low,,,,,ASEAN MRA does not replace national law; provides facilitation for compliant products; verify each MS separately
7,Capsule lessive (pod),Détergent + biocide,MERCOSUR,MERCOSUR,Latin America,GMC Resolution on Household Chemical Products Labeling,GMC Resolution No. 36/1996 (Labeling of Household Chemical Products),MERCOSUR Common Market Group / national agencies (ANMAT-AR; INMETRO-BR; INSP-UY; INAN-PY),Common labeling requirements for household chemical products in MERCOSUR zone; ingredient listing; hazard symbols; child-safety warnings; language requirements per member state,in_force,medium,,,,,MERCOSUR GMC Res 36/1996 harmonizes detergent labeling; individual MS may have additional rules (see AR, BR rows)
7,Capsule lessive (pod),Détergent + biocide,CO,Colombia,Latin America,Decreto 1545/1998 — Productos de Aseo Higiene y Limpieza,Decreto 1545 de 1998,INVIMA (Instituto Nacional de Vigilancia de Medicamentos y Alimentos),Registro sanitario (sanitary registration) mandatory for household cleaning products; labeling in Spanish; ingredient disclosure; child-safety closure for pods; net content; manufacturer/importer info,in_force,high,,,,,Colombia: INVIMA sanitary registration required before commercialization; pods classified as household cleaning product
7,Capsule lessive (pod),Détergent + biocide,EG,Egypt,Middle East & Africa,Egyptian Organization for Standardization (EOS) — Detergents,EOS Standard ES 2500 / Chemical Products Standards,Egyptian Organization for Standardization and Quality (EOS),Type approval and conformity certificate for imported detergents; Arabic labeling mandatory; ingredient disclosure; SDS; EOS conformity certificate at customs; pods must meet physical-chemical requirements,in_force,high,,,,,Egypt: EOS certification required for import; Arabic label mandatory; border inspection by GOEIC (General Organization for Export and Import Control)
7,Capsule lessive (pod),Détergent + biocide,MA,Morocco,Middle East & Africa,Décret n° 2-12-198 relatif aux produits chimiques dangereux,Décret n° 2-12-198 du 2013,Ministère de l'Industrie et du Commerce / ONSSA,Classification et étiquetage des produits chimiques dangereux; Arabic+French labeling; SDS en français/arabe; enregistrement auprès du Ministère; les pods classés produit chimique dangereux,in_force,high,,,,,Maroc: décret 2-12-198 cadre primaire; étiquetage bilingue arabe/français obligatoire; enregistrement importer
7,Capsule lessive (pod),Détergent + biocide,NG,Nigeria,Middle East & Africa,NAFDAC Regulation on Household Chemicals and Cleaning Products,NAFDAC Regulation 2019 / Food and Drugs Act Cap F33,National Agency for Food and Drug Administration and Control (NAFDAC),NAFDAC product registration mandatory for household cleaning products including laundry pods; labeling in English; ingredient disclosure; manufacturer and importer info; safety warnings; child-resistant closure,in_force,high,,,,,Nigeria: NAFDAC registration is prerequisite for import and sale; registration valid 5 years; local responsible agent required
7,Capsule lessive (pod),Détergent + biocide,KE,Kenya,Middle East & Africa,Standards Act Cap 496 — KEBS Compulsory Standards + PVoC,Kenya Bureau of Standards (KEBS) PVoC Programme,Kenya Bureau of Standards (KEBS),Pre-Export Verification of Conformity (PVoC) required for imported consumer goods including detergents; conformity to applicable KS standard; certificate of conformity before shipment; labeling in English,in_force,high,,,,,Kenya PVoC mandatory for imports; KEBS issues Certificate of Conformity at origin; detergent pods require inspection pre-shipment
7,Capsule lessive (pod),Détergent + biocide,OECD,OECD,International,OECD HPV Chemicals Programme — High Production Volume Chemicals Assessment,OECD Cooperative Chemicals Assessment Programme,OECD Chemicals Committee,Hazard assessment of HPV chemicals including surfactants in detergent pods; OECD test guidelines (TG 301/302/306) for biodegradability; SIDS initial assessment; data sharing obligations for producers,in_force,low,,,,,OECD soft-law applicable to formulation and safety chemical assessment; no binding enforcement but referenced by REACH/EPA/TCSA
7,Capsule lessive (pod),Détergent + biocide,WADA,WADA,International,WADA Prohibited List — Not Applicable to Detergent Products,World Anti-Doping Code 2024 — Prohibited List,World Anti-Doping Agency (WADA),WADA Prohibited List governs doping in sport; not applicable to household laundry detergent pods; no prohibited substances relevant; jurisdiction included for completeness,not_applicable,low,,,,,Not applicable: WADA regulates doping in sport; laundry pods have no relevance to WADA framework
7,Capsule lessive (pod),Détergent + biocide,UNECE,UNECE,International,UNECE GHS — Globally Harmonized System of Classification and Labelling,UN GHS Rev. 9 (2021),United Nations Economic Commission for Europe (UNECE),GHS underpins classification and labeling systems worldwide; pods typically classified as Acute Tox 4 (oral) + Skin Corr 1; recommended labeling elements; basis for EU CLP and many national GHS implementations,in_force,low,,,,,UNECE GHS is soft-law framework; binding implementation via national regulations (CLP in EU; HazCom in US; etc.); relevant to pod label design globally
7,Capsule lessive (pod),Détergent + biocide,CODEX,Codex Alimentarius,International,Codex Alimentarius — Not Applicable to Laundry Detergent Pods,Codex Alimentarius Commission Standards,FAO/WHO Codex Alimentarius Commission,Codex standards govern food safety; not applicable to laundry detergent pods; no Codex standard covers household cleaning products; jurisdiction included for completeness,not_applicable,low,,,,,Not applicable: Codex covers food/feed; laundry pods are non-food chemical products outside Codex scope
8,Complément alimentaire vitamines,Food supplement,EU,European Union,Europe,Directive compléments alimentaires,Directive 2002/46/EC,EC DG SANTE + NCAs,"Harmonisation des listes de vitamines/minéraux autorisés (Annexe I); formes sources autorisées (Annexe II); limites d'UL à définir par États membres; notification avant mise sur marché selon droit national",in_force,critical,,,,,Directive laisse marge nationale sur LMS (upper limits); liste positive vitamines/minéraux; base réglementaire principale EU
8,Complément alimentaire vitamines,Food supplement,EU,European Union,Europe,Règlement adjonction vitamines minéraux,"Regulation (EC) 1925/2006",EC DG SANTE,"Substances ajoutées aux aliments (fortification); listes Annexe I (autorisées) / Annexe III (restrictions/interdictions); compléments alimentaires dans son champ quand ajout volontaire; sources pureté requise",in_force,critical,,,,,Complète Directive 2002/46; s'applique si vitamines/minéraux ajoutés hors liste ou avec restrictions
8,Complément alimentaire vitamines,Food supplement,EU,European Union,Europe,Règlement allégations nutritionnelles et de santé,"Regulation (EC) 1924/2006",EC DG SANTE + EFSA,"Allégations nutritionnelles (ex. «riche en vitamine C»): conditions spécifiques; allégations de santé: liste positive Article 13 (Règl. 432/2012); allégations réduction de risque: Article 14; interdiction allégations médicales",in_force,critical,,,,,Registre EU d'allégations de santé autorisées obligatoire; allégations non listées = interdites
8,Complément alimentaire vitamines,Food supplement,EU,European Union,Europe,Règlement information consommateurs (FIC),"Regulation (EU) 1169/2011",EC DG SANTE,"Étiquetage obligatoire: dénomination «complément alimentaire»; dose journalière recommandée (DJR); avertissement «ne pas dépasser la dose journalière»; avertissement «tenir hors de portée des enfants»; valeur nutritive si allégation",in_force,critical,,,,,FIC s'applique aux compléments alimentaires; tableau nutritionnel optionnel sauf allégation
8,Complément alimentaire vitamines,Food supplement,EU,European Union,Europe,Règlement aliments groupes spécifiques,"Regulation (EU) 609/2013",EC DG SANTE,"Régit aliments pour nourrissons/enfants/sportifs; compléments alimentaires destinés à ces groupes doivent respecter prescriptions; ne pas faire de claims «pour sportifs» si non conforme",in_force,high,,,,,Pertinent si le complément cible sportifs ou enfants; exigences supplémentaires
8,Complément alimentaire vitamines,Food supplement,EU,European Union,Europe,Avis scientifiques EFSA — sécurité vitamines,EFSA Scientific Opinions on Tolerable Upper Intake Levels,EFSA (European Food Safety Authority),"EFSA établit les UL (Tolerable Upper Intake Levels) par nutriment; base pour fixation des LMS nationales; avis disponibles pour vitamines A/D/E/K/B6/B12/C/folate/iode/zinc/fer/calcium/magnésium etc.",in_force,high,,,,,Pas de règlement unique EU fixant les LMS; États membres s'appuient sur EFSA UL pour fixer leurs limites nationales
8,Complément alimentaire vitamines,Food supplement,FR,France,Europe,Décret compléments alimentaires France,Décret n° 2006-352 du 20 mars 2006,DGCCRF + ANSES,"Notification obligatoire DGCCRF via Téléicare avant mise sur marché; liste positive substances actives; étiquetage obligatoire: DJR/VNR%; avertissement surdosage; forme galénique (gélule/comprimé/poudre); interdiction claims médicaux",in_force,critical,,,,,Notification via Téléicare (plateforme DGCCRF) = spécificité française; délai 2 mois avant commercialisation; ANSES peut émettre avis risque
8,Complément alimentaire vitamines,Food supplement,FR,France,Europe,Arrêté vitamines minéraux France — formes et teneurs,Arrêté du 9 mai 2006 (modifié 2014 et 2023),DGCCRF / Ministère de l'Économie,"Liste des vitamines et minéraux autorisés; formes chimiques sources autorisées; teneurs maximales par DJR fixées par arrêté (ex. vitamine D3 max 50 µg/j); valeurs de référence VNR",in_force,critical,,,,,Arrêté plus restrictif que Directive UE sur certains nutrients (ex. vit.D); vérifier arrêtés modificatifs récents (2023)
8,Complément alimentaire vitamines,Food supplement,DE,Germany,Europe,Nahrungsergänzungsmittelverordnung (NemV),NemV du 24 mai 2004 (dernière modif. 2023),BVL (Bundesamt für Verbraucherschutz und Lebensmittelsicherheit),"Notification obligatoire BVL avant première mise sur marché en Allemagne; liste positive vitamines/minéraux + sources (Annexe 1); LMS fixées par Allemagne (BfR recommandations); étiquetage: DJR VNR%; avertissement enfants/grossesse",in_force,critical,,,,,BfR a émis des recommandations de LMS qui de facto s'imposent; notification en ligne BVL; amende jusqu'à 50 000 € si non déclaré
8,Complément alimentaire vitamines,Food supplement,IT,Italy,Europe,DL 169/2004 compléments alimentaires Italie,Decreto Legislativo 21 maggio 2004 n. 169,Ministero della Salute,"Notification obligatoire Ministero della Salute via portail; liste vitamines/minéraux + formes + teneurs (liste nationale + UE); étiquetage en italien; dose journalière; avertissement dépassement",in_force,critical,,,,,Italie maintient liste nationale spécifique; Ministero della Salute publie tableau actualisé des substances autorisées; notification très rapide (ack immédiat)
8,Complément alimentaire vitamines,Food supplement,IT,Italy,Europe,Notification Ministero della Salute — procédure en ligne,Portale dei Prodotti Alimentari (PPA),Ministero della Salute,"Soumission notification en ligne via PPA; paiement droit d'enregistrement; attribution numéro d'autorisation avant commercialisation; modification produit = nouvelle notification",in_force,high,,,,,Système PPA en ligne; délai traitement ~ 30 jours; certification traducteur si documents étrangers
8,Complément alimentaire vitamines,Food supplement,ES,Spain,Europe,Real Decreto 1487/2009 compléments alimentaires Espagne,Real Decreto 1487/2009 de 26 septembre 2009,AESAN (Agencia Española de Seguridad Alimentaria y Nutrición),"Notification obligatoire AESAN avant commercialisation; liste substances autorisées (vitamines/minéraux) + formes + LMS; étiquetage en espagnol: DJR; mentions obligatoires; interdiction claims thérapeutiques",in_force,critical,,,,,AESAN maintient registre public des compléments notifiés; nouvelles substances = avis AESAN + approbation AESAN/MSPSI
8,Complément alimentaire vitamines,Food supplement,NL,Netherlands,Europe,Warenwetbesluit vrijstellingsregeling vitaminen en mineralen,Warenwetbesluit Vrijstellingsregeling Vitaminen en Mineralen 2021,NVWA (Nederlandse Voedsel en Waren Autoriteit),"Notification via NVWA avant mise sur marché; LMS fixées par arrêté néerlandais (Tableau 1 valeurs max/DJR); liste formes autorisées; étiquetage: DJR; mentions de sécurité",in_force,high,,,,,Pays-Bas = LMS parmi les plus restrictives d'UE; revues suite Gezondheidsraad; KAG (Keuringsraad) vérifie allégations publicité
8,Complément alimentaire vitamines,Food supplement,GB,United Kingdom,Europe,UK Food Supplements Regulations 2003,Food Supplements (England) Regulations 2003 (SI 2003/1387) + equivalents Écosse/Galles/Irlande du Nord,Food Standards Agency (FSA),"Post-Brexit: maintient listes de vitamines/minéraux + formes (Annexe I/II équivalent); notification non requise au niveau UK (pas de système centralisé); étiquetage UK: mentions obligatoires, DJR UK RNI/DRV; interdiction claims médicaux",in_force,critical,,,,,Post-Brexit: UK conserve le cadre 2003; DHSC/FSA envisage révision des UL UK; pas de notification centralisée UK mais étiquetage en anglais UK obligatoire
