product_id,product_name,product_regime_tag,jurisdiction_code,jurisdiction_name,region,regulation_name,regulation_ref,enforcement_body,key_requirements,status,criticality,legal_api_match,legal_api_id,legal_api_match_method,gap_action,notes
4,Peluche bébé 0-3 ans,Jouet enfant,ASEAN,ASEAN,Asia-Pacific,ASEAN Chemical Safety Harmonisation — Toys,ASEAN Sectoral MRA on Electrical & Electronic Equipment + chemicals harmonisation roadmap,ASEAN Secretariat + ACCSQ,"Harmonisation of phthalate restrictions; heavy metal migration limits; azo dye restrictions; aligned with ISO 8124-3",in_force,low,,,,,ASEAN chemical harmonisation for toys still largely aspirational; defer to individual country requirements
4,Peluche bébé 0-3 ans,Jouet enfant,GCC,GCC,MENA & Africa,GCC Technical Regulation GSO 1819-1 — Toy Safety,GSO 1819-1:2019 (Mechanical and Physical Properties) + GSO Technical Regulation on Toy Safety,SASO (Saudi) + ESMA (UAE) + QOSM (Qatar) + ENAS (Bahrain) + etc.,"IECEE CB Scheme or GCC certification; GSO 1819 series (aligned ISO 8124); age grading; small parts test; chemical migration; flammability; Arabic labeling mandatory; SASO COC required for Saudi imports",in_force,critical,,,,,GCC Technical Regulation on toys mandatory across 6 Gulf states; Arabic labeling required; SASO product certification (SALEEM program) for Saudi Arabia
4,Peluche bébé 0-3 ans,Jouet enfant,GCC,GCC,MENA & Africa,GCC BD 131 — Chemical Requirements for Toys,GSO Technical Regulation BD 131 + GSO 1819-3 (chemical migration),GSO (Gulf Standardization Organization),"Heavy metal migration limits aligned with ISO 8124-3; phthalate restrictions aligned with international standards; azo dye restrictions; formaldehyde limits",in_force,critical,,,,,Chemical requirements for toys in GCC; phthalate and heavy metal testing required for market access; SASO COC certificate covers chemical compliance
4,Peluche bébé 0-3 ans,Jouet enfant,GCC,GCC,MENA & Africa,SASO CoC + SALEEM Program — Saudi Arabia Toy Import,SASO Circular 2018 + SALEEM electronic approval system,SASO (Saudi Standards Metrology and Quality Organization),"Certificate of Conformity (CoC) mandatory for toys imported into Saudi Arabia; SASO-approved testing lab; SALEEM online approval; Arabic labeling; age grading; safety warnings in Arabic",in_force,critical,,,,,Saudi Arabia (largest GCC market) requires SASO CoC via SALEEM system; additional requirements beyond GSO standards; Arabic language mandatory
4,Peluche bébé 0-3 ans,Jouet enfant,IL,Israel,MENA & Africa,SI 1234 — Israeli Toy Safety Standard,SI 1234 (Standards Institution of Israel — toy safety; aligned with EN 71),SII (Standards Institution of Israel) + ILNAS + Ministry of Economy,"Mandatory standard; CE marking accepted for EU-compliant toys (bilateral recognition); SII conformity mark; age grading; small parts test; Hebrew labeling mandatory; chemical migration",in_force,critical,,,,,Israel accepts CE marking for toys as equivalent; SII mandatory standard SI 1234 aligned with EN 71; Hebrew labeling required
4,Peluche bébé 0-3 ans,Jouet enfant,IL,Israel,MENA & Africa,Israeli Consumer Products Safety Law — Chemical Restrictions,Consumer Products Safety Law 5762-2001 (Israel) + SII chemical standards,SII + Ministry of Economy,"Phthalate restrictions; heavy metal migration; lead paint ban; aligned with EN 71-3 and REACH",in_force,high,,,,,Israel largely follows EU/EN 71 framework; REACH-aligned chemical restrictions increasingly adopted
4,Peluche bébé 0-3 ans,Jouet enfant,EG,Egypt,MENA & Africa,ES 1322 — Egyptian Standard for Toy Safety,ES 1322 (aligned with ISO 8124),EOS (Egyptian Organization for Standardization) + GOEIC,"Mandatory conformity; GOEIC conformity certificate required for imports; age grading; small parts test; chemical migration; Arabic and English labeling; GOEIC inspection at port",in_force,critical,,,,,Egypt requires GOEIC certificate of conformity for imported toys; ES 1322 aligned with ISO 8124; port inspection common
4,Peluche bébé 0-3 ans,Jouet enfant,EG,Egypt,MENA & Africa,Law 67/2006 — Consumer Protection (Egypt) Toy Requirements,Law 67/2006 Consumer Protection Law + Ministerial Decree on toy safety,CPA (Consumer Protection Agency Egypt),"General product safety; labeling requirements in Arabic; manufacturer/importer identification; age grading; hazard warnings",in_force,high,,,,,Egypt's consumer protection law requires Arabic labeling; CPA has enforcement authority for toy safety
4,Peluche bébé 0-3 ans,Jouet enfant,MA,Morocco,MENA & Africa,NM 03.4.001 — Norme Marocaine Sécurité Jouets,NM 03.4.001 (aligned with EN 71 / ISO 8124) + NM ISO 8124 adoption,IMANOR (Institut Marocain de Normalisation) + MCINET,"Mandatory conformity marking (NM mark); IMANOR or accredited lab testing; age grading; small parts test; chemical migration; labeling in Arabic and French; CE marking often accepted as evidence of compliance",in_force,high,,,,,Morocco aligns toy standards with EU (EN 71) and ISO 8124; CE marking largely accepted; French and Arabic labeling required
4,Peluche bébé 0-3 ans,Jouet enfant,MA,Morocco,MENA & Africa,Loi 24-09 — Sécurité des produits et des services (Maroc),Loi n° 24-09 relative à la sécurité des produits et des services (2011),MCINET + IMANOR,"Obligations générales de sécurité; marquage d'âge; avertissements en arabe et français; responsabilité fabricant/importateur; rappels",in_force,high,,,,,Loi 24-09 provides general product safety framework; toy regulations derived from NM standards; French/Arabic bilingual requirement
4,Peluche bébé 0-3 ans,Jouet enfant,ZA,South Africa,MENA & Africa,Compulsory Specification VC 8052 — Toys,VC 8052 (issued under the National Regulator for Compulsory Specifications Act),NRCS (National Regulator for Compulsory Specifications),"NRCS Letter of Authority (LOA) mandatory for toys; SABS ISO 8124 compliance; age grading; small parts test; chemical migration; flammability; English labeling; importer LOA registration",in_force,critical,,,,,South Africa requires NRCS LOA for all toys imported and sold; compliance with SABS (ISO 8124) mandatory; LOA obtained prior to importation
4,Peluche bébé 0-3 ans,Jouet enfant,ZA,South Africa,MENA & Africa,SABS ISO 8124 — South African Toy Safety Standard,SABS ISO 8124-1; SABS ISO 8124-2; SABS ISO 8124-3,SABS (South African Bureau of Standards) + NRCS,"Mechanical and physical safety; flammability; chemical migration; small parts test; age grading; English labeling; NRCS LoA",in_force,critical,,,,,SABS adopts ISO 8124 as national standard; testing at SABS or accredited lab; basis for NRCS VC 8052 compulsory specification
4,Peluche bébé 0-3 ans,Jouet enfant,NG,Nigeria,MENA & Africa,SON Mandatory Standard — Toys (Nigeria),SON (Standards Organisation of Nigeria) NIS ISO 8124 adoption,SON (Standards Organisation of Nigeria),"SON Product Certification Scheme (MANCAP mark); NIS ISO 8124 standards; age grading; small parts test; chemical migration; English labeling",in_force,high,,,,,Nigeria requires MANCAP certification for consumer goods including toys; SON enforcement at ports; NIS ISO 8124 aligned with international standards
4,Peluche bébé 0-3 ans,Jouet enfant,NG,Nigeria,MENA & Africa,Consumer Protection Framework — Nigeria Toy Safety,FCCPA (Federal Competition and Consumer Protection Act) 2019 + NAFDAC,FCCPC + NAFDAC,"General product safety; chemical restrictions (NAFDAC); labeling requirements; age grading; consumer complaint mechanism",in_force,medium,,,,,Nigerian enforcement improving under FCCPC; NAFDAC involvement for chemical aspects; SON MANCAP primary certification route
4,Peluche bébé 0-3 ans,Jouet enfant,KE,Kenya,MENA & Africa,KS ISO 8124 — Kenya Standard for Toy Safety,KS ISO 8124-1; KS ISO 8124-2; KS ISO 8124-3 (KEBS adoption),KEBS (Kenya Bureau of Standards),"Diamond Mark of Quality (KEBS certification); age grading; small parts test; chemical migration; flammability; English labeling; KEBS import inspection",in_force,high,,,,,Kenya requires KEBS Diamond Mark for toys; KS ISO 8124 aligned with ISO 8124; KEBS conducts import inspection; Pre-Export Verification of Conformity (PVoC) scheme
4,Peluche bébé 0-3 ans,Jouet enfant,KE,Kenya,MENA & Africa,Kenya Pre-Export Verification of Conformity (PVoC) — Toys,KEBS PVoC Program (applicable to toy imports),KEBS,"PVoC certificate of conformity required before shipment to Kenya; third-party inspection in country of origin; testing to KS ISO 8124; consignment cannot clear customs without PVoC CoC",in_force,critical,,,,,Kenya PVoC scheme is operationally critical — requires pre-shipment inspection and CoC; applies to toys; third-party inspectors (SGS Bureau Veritas Intertek) conduct PVoC
4,Peluche bébé 0-3 ans,Jouet enfant,ISO,ISO/IEC,International,ISO 8124-1:2023 — Mechanical and Physical Properties,ISO 8124-1:2023 (5th edition),ISO/TC 181,"International reference standard: small parts cylinder test; tensile and torque tests; sharp points and edges; bite and squeeze tests; accessibility tests; drop test; age grading criteria; basis for all national toy standards",in_force,high,,,,,ISO 8124-1 is the global technical baseline; used by AU NZ IN MY VN ID PH as direct national adoption; also basis for EN 71-1 GB 6675-2 ASTM F963
4,Peluche bébé 0-3 ans,Jouet enfant,ISO,ISO/IEC,International,ISO 8124-2:2023 — Flammability,ISO 8124-2:2023 (2nd edition),ISO/TC 181,"Flammability requirements for toy materials; burn rate test; ignition resistance; specific pile fabric test; applicable to plush toys; surface burning rate limits",in_force,high,,,,,ISO 8124-2 is the international flammability reference; used as basis for EN 71-2 GB 6675.3 and national standards; plush pile fabric specific test
4,Peluche bébé 0-3 ans,Jouet enfant,ISO,ISO/IEC,International,ISO 8124-3:2020 — Migration of Certain Elements,ISO 8124-3:2020 (4th edition),ISO/TC 181,"Heavy metal migration limits (Sb As Ba Cd Cr(VI) Co Cu Pb Mn Hg Ni Se Sr Sn Zn) by material category; dry brittle powder liquid categories; basis for EN 71-3 GB 6675.4 IS 9873-3 etc.; strictest limits for scraped materials in toys for <36 months",in_force,high,,,,,ISO 8124-3 is the global chemical migration reference; cadmium and lead limits extremely restrictive; all major markets use this or derived standard for heavy metal testing
4,Peluche bébé 0-3 ans,Jouet enfant,ISO,ISO/IEC,International,ISO 8124-4:2014 — Swings Slides and Similar,ISO 8124-4:2014,ISO/TC 181,"Specific to playground/outdoor equipment; not directly applicable to plush but part of ISO 8124 framework",in_force,low,,,,,ISO 8124-4 not applicable to plush toys; included for completeness of ISO 8124 framework reference
4,Peluche bébé 0-3 ans,Jouet enfant,ISO,ISO/IEC,International,ISO 8124-6:2023 — Graphical Symbols for Age Warning Labels,ISO 8124-6:2023,ISO/TC 181,"Age warning symbols; internationally harmonised graphical symbols for: small parts warning (cylinder symbol); age grading; safety warnings; used in EU (EN 71 Annex V) US (ASTM F963) and globally",in_force,high,,,,,Critical for plush 0-3 ans: the small parts warning cylinder symbol must appear on packaging per most jurisdictions; ISO 8124-6 provides the harmonised symbol specifications
4,Peluche bébé 0-3 ans,Jouet enfant,CODEX,Codex Alimentarius,International,Codex Alimentarius — N/A for toy safety,N/A,Codex Alimentarius Commission,"Codex Alimentarius covers food safety standards; not applicable to non-food toys; occasionally referenced for food-contact toy accessories (teethers mouthed items) but plush toys do not fall under Codex scope",not_applicable,low,,,,,Codex not applicable to plush toys; included for completeness of 50-jurisdiction coverage
4,Peluche bébé 0-3 ans,Jouet enfant,UNECE,UNECE WP.29,International,UNECE WP.29 — N/A for toy safety,N/A,UNECE World Forum for Harmonization of Vehicle Regulations,"UNECE WP.29 covers vehicle safety regulations; not applicable to toys; no UNECE framework for toy product safety",not_applicable,low,,,,,UNECE not applicable to plush toys; included for completeness of 50-jurisdiction coverage
4,Peluche bébé 0-3 ans,Jouet enfant,WADA,WADA,International,WADA — N/A for toy safety,N/A,World Anti-Doping Agency,"WADA governs anti-doping in sport; not applicable to toys or children's products",not_applicable,low,,,,,WADA not applicable to plush toys; included for completeness of 50-jurisdiction coverage
4,Peluche bébé 0-3 ans,Jouet enfant,OECD,OECD,International,OECD Product Safety Guidelines — soft reference,OECD Guidelines for Multinational Enterprises + OECD Consumer Product Safety Policy Guidance,OECD Consumer Policy Committee,"OECD provides policy guidance on consumer product safety (recalls cooperation; product safety in e-commerce); OECD Global Recall portal; not binding but referenced by national authorities for recall coordination; OECD guidance on toy chemicals and endocrine disruptors",in_force,low,,,,,OECD not a binding regulator; global recall portal (globalrecalls.oecd.org) is useful for monitoring toy recalls across jurisdictions; OECD endocrine disruptor guidance may influence future toy chemical restrictions
"5","Pansement adhésif","Dispositif médical Cl. I","EU","European Union","Europe","MDR (EU) 2017/745 — Dispositif médical Classe I","Regulation (EU) 2017/745","EC DG SANTE + NCA competentes","Classification Annexe VIII Règle 1 → Classe I; Declaration de conformité; Technical Documentation (TD); CE marking; auto-certification sans organisme notifié; labeling per Annexe I; General Safety and Performance Requirements (GSPR)","in_force","critical","","","","","Pansement adhésif = Classe I non-stérile non-mesurant; pas d'ON requis; autocertification suffisante; TD obligatoire"
"5","Pansement adhésif","Dispositif médical Cl. I","EU","European Union","Europe","UDI + enregistrement EUDAMED","MDR Art. 27-29 + Règlement délégué (UE) 2017/2185","EC / EUDAMED","Système UDI obligatoire (Basic UDI-DI + UDI-DI + UDI-PI); enregistrement opérateur économique dans EUDAMED; déclaration de conformité UE téléversée; surveillance post-commercialisation","in_force","high","","","","","Phase de déploiement EUDAMED en cours; UDI obligatoire pour Classe I depuis 26 mai 2025"
"5","Pansement adhésif","Dispositif médical Cl. I","EU","European Union","Europe","ISO 13485 — Système de management de la qualité (UE)","ISO 13485:2016","Organisme notifié / autoévaluation","QMS couvrant conception fabrication contrôle qualité; obligatoire de facto pour TD MDR; traçabilité lots; gestion réclamations; CAPA; revue de direction","in_force","high","","","","","Pas obligatoire formellement pour Cl. I mais exigé de facto par clients distributeurs et pour robustesse TD"
"5","Pansement adhésif","Dispositif médical Cl. I","FR","France","Europe","MDR (EU) 2017/745 — applicable en France","Regulation (EU) 2017/745","ANSM","Même exigences MDR qu'au niveau UE; Responsible Person (mandataire si hors UE); notification incidents graves à ANSM; surveillance du marché par ANSM; étiquetage en français obligatoire","in_force","critical","","","","","France = État membre UE; pas de régulation nationale additionnelle distincte pour DM Cl. I"
"5","Pansement adhésif","Dispositif médical Cl. I","FR","France","Europe","Matério-vigilance ANSM","Code de la Santé Publique Art. L5212-2","ANSM","Déclaration obligatoire incidents graves et risques graves au délai ANSM; suivi des FSCA (Field Safety Corrective Actions); portail de déclaration ANSM","in_force","high","","","","","Spécificité FR: matériovigilance nationale en sus du système UE EUDAMED"
"5","Pansement adhésif","Dispositif médical Cl. I","DE","Germany","Europe","MDR (EU) 2017/745 — applicable in Germany","Regulation (EU) 2017/745 + MPDG (Medizinprodukterecht-Durchführungsgesetz)","BfArM + Landesbehörden","CE marking Class I; MPDG as national implementation act; German-language labeling; market surveillance by Länder authorities; incident reporting via national portal","in_force","critical","","","","",""
"5","Pansement adhésif","Dispositif médical Cl. I","DE","Germany","Europe","MPDG — Medizinprodukterecht-Durchführungsgesetz","MPDG 2021 (BGBl. I 2021 Nr. 4)","BfArM","National implementing legislation for MDR; vigilance reporting; national competent authority procedures; economic operators registration","in_force","medium","","","","",""
"5","Pansement adhésif","Dispositif médical Cl. I","IT","Italy","Europe","MDR (EU) 2017/745 — applicable in Italy","Regulation (EU) 2017/745 + D.Lgs. 137/2022","Ministero della Salute / ISS","CE marking Class I; Italian-language labeling; incident reporting to Ministero della Salute; ANSM analog = ISS/Min Salute","in_force","critical","","","","",""
"5","Pansement adhésif","Dispositif médical Cl. I","ES","Spain","Europe","MDR (EU) 2017/745 — applicable in Spain","Regulation (EU) 2017/745 + RD 192/2023","AEMPS","CE marking Class I; Spanish-language labeling; AEMPS market surveillance; registro EUDAMED; vigilancia y notificacion incidentes graves","in_force","critical","","","","",""
"5","Pansement adhésif","Dispositif médical Cl. I","NL","Netherlands","Europe","MDR (EU) 2017/745 — applicable in Netherlands","Regulation (EU) 2017/745 + Wet medische hulpmiddelen","CIBG / IGJ","CE marking Class I; Dutch-language labeling; CIBG registration for economic operators; IGJ market surveillance; incident reporting","in_force","critical","","","","",""
"5","Pansement adhésif","Dispositif médical Cl. I","GB","United Kingdom","Europe","UK MDR 2002 (post-Brexit) + UKCA marking","UK Medical Devices Regulations 2002 SI 2002/618 (as amended 2019/791)","MHRA","UKCA mark for Great Britain (CE still accepted transitionally to June 2028); Class I self-declaration; UK Responsible Person required; labeling must include UK RP address","in_force","critical","","","","","Post-Brexit: UKCA replaces CE for GB market; Northern Ireland → CE/UKNI dual marking under Windsor Framework"
"5","Pansement adhésif","Dispositif médical Cl. I","GB","United Kingdom","Europe","MHRA Device Registration","UK MDR 2002 Reg. 14A + MHRA Guidance","MHRA","Registration on MHRA registration portal; UK Responsible Person must register; annual renewal; device listing including UDI information","in_force","critical","","","","",""
"5","Pansement adhésif","Dispositif médical Cl. I","GB","United Kingdom","Europe","ISO 13485 — QMS (UK context)","ISO 13485:2016 (adopted as BS EN ISO 13485)","BSI / UKAS accredited CBs","QMS certification recommended for UK market; MHRA expects quality management aligned with ISO 13485; required by most UK distributors","in_force","high","","","","",""
"5","Pansement adhésif","Dispositif médical Cl. I","CH","Switzerland","Europe","MedDO — Medizinprodukteverordnung (Swiss)","SR 812.213 MedDO (en vigueur 26.05.2021)","Swissmedic","Adoption du MDR UE par équivalence via accord MRA révisé; enregistrement auprès de Swissmedic; CH Représentant autorisé requis si fabricant hors CH; étiquetage CH-RE; système UDI aligné MDR","in_force","critical","","","","","Swissmedic reconnaît la certification CE/MDR; accord MRA CH-UE non totalement actualisé → vigilance requise"
"5","Pansement adhésif","Dispositif médical Cl. I","CH","Switzerland","Europe","Swissmedic — Enregistrement opérateur économique","MedDO Art. 54-60","Swissmedic","Enregistrement fabricants et importateurs dans base Swissmedic; Mandataire suisse (CH-REP) obligatoire pour fabricants non-CH; notification incidents graves à Swissmedic","in_force","high","","","","",""
"5","Pansement adhésif","Dispositif médical Cl. I","NO","Norway","Europe","MDR (EU) 2017/745 — applicable in Norway (EEA)","Regulation (EU) 2017/745 (incorporated via EEA Agreement)","Statens legemiddelverk (NOMA)","Même exigences MDR via accord EEE; CE marking valide; Class I auto-certification; Norwegian-language labeling recommended; vigilance reporting to NOMA","in_force","critical","","","","","Norvège = EEE/EEA: MDR directement applicable via accord EEE; NOMA = autorité compétente"
"5","Pansement adhésif","Dispositif médical Cl. I","RU","Russia","Europe","EAEU Decision 46 — Règlement commun dispositifs médicaux","EAEU Council Decision 46 of 12.02.2016","Roszdravnadzor (RU) + autorités EAEU","Enregistrement DM dans le Registre EAEU unifié; classification Classe I → procédure simplifiée; dossier technique + études de sécurité; marquage EAEU; étiquetage en russe","in_force","critical","","","","","EAEU = Union économique eurasiatique (RU BY KZ AM KG); enregistrement EAEU valide dans tous les États membres"
"5","Pansement adhésif","Dispositif médical Cl. I","RU","Russia","Europe","Roszdravnadzor — Enregistrement national russe","Federal Law No. 323-FZ + Postanovleniya Pravitelstva","Roszdravnadzor","Enregistrement certificat d'État russe; dossier en russe; tests locaux possibles; renouvellement périodique; vigilance nationale","in_force","critical","","","","","Contexte géopolitique 2024: vérifier sanctions et restrictions export applicables"
"5","Pansement adhésif","Dispositif médical Cl. I","EAEU","EAEU","Europe","EAEU — Règlement commun DM (Decision 46)","EAEU Council Decision 46/2016","Commission économique eurasiatique","Enregistrement unifié EAEU valable RU/BY/KZ/AM/KG; classification Cl.I; dossier technique commun; étiquetage multilingue (russe + langues nationales); système UDI EAEU en développement","in_force","critical","","","","",""
"5","Pansement adhésif","Dispositif médical Cl. I","TR","Turkey","Europe","TITCK + ÜTS — Enregistrement dispositif médical","Tıbbi Cihaz Yönetmeliği (2021) aligné MDR","TITCK (Turkish Medicines and Medical Devices Agency)","Enregistrement dans ÜTS (Ürün Takip Sistemi); déclaration conformité Classe I; mandataire turc requis; étiquetage en turc; vigilance TITCK; UDI via ÜTS","in_force","critical","","","","","Turquie aligne sa réglementation sur MDR 2017/745; ÜTS est le registre national obligatoire pour tous les DM"
"5","Pansement adhésif","Dispositif médical Cl. I","UA","Ukraine","Europe","Ukraine — Enregistrement DM auprès du MoH","Order of MoH Ukraine No. 753/2016 + post-2022 updates","Ministry of Health Ukraine / State Expert Center","Enregistrement national auprès du MoH Ukraine; certificat d'homologation; dossier en ukrainien; Classe I → procédure simplifiée","in_force","medium","","","","","Contexte guerre: réglementations allégées temporaires possibles; UE aide à harmonisation future"
"5","Pansement adhésif","Dispositif médical Cl. I","US","United States","Americas","FDA 21 CFR Part 880.5240 — Adhesive bandage (Class I 510(k) Exempt)","21 CFR Part 880.5240","FDA CDRH","Adhesive bandage classified as Class I device; 510(k) Exempt (General Controls only); no premarket submission required; General Controls: establishment registration; device listing; labeling; GMP/QSR; prohibited acts","in_force","critical","","","","","Exemption from 510(k) premarket notification; General Controls apply"
"5","Pansement adhésif","Dispositif médical Cl. I","US","United States","Americas","FDA Establishment Registration + Device Listing (21 CFR 807)","21 CFR Part 807","FDA CDRH","Annual establishment registration with FDA (Oct 1-Dec 31); device listing (Form FDA 3881); US Agent required for foreign establishments; registration fee applicable","in_force","critical","","","","",""
"5","Pansement adhésif","Dispositif médical Cl. I","US","United States","Americas","FDA UDI Final Rule — 21 CFR Part 801 Subpart B","21 CFR Part 801.20-801.60","FDA CDRH","UDI label requirement: Device Identifier (DI) + Production Identifier (PI); GUDID database submission; barcode or RFID on label; Class I labeling compliance","in_force","high","","","","",""
"5","Pansement adhésif","Dispositif médical Cl. I","US","United States","Americas","FDA QSR 21 CFR Part 820 — Quality System Regulation","21 CFR Part 820 (harmonizing with ISO 13485 via QMSR 2024)","FDA CDRH","Design controls; document controls; CAPA; complaint handling; production controls; labeling controls; distribution records; QSR now aligned with ISO 13485:2016 per FDA 2024 rule effective Feb 2026","in_force","high","","","","",""
"5","Pansement adhésif","Dispositif médical Cl. I","US-CA","California","Americas","Proposition 65 — Warning si latex / produits chimiques","California Safe Drinking Water and Toxic Enforcement Act of 1986 (Prop 65)","California OEHHA / California AG","Avertissement obligatoire si produit contient substances listées Prop 65 (latex naturel; adhésifs contenant DEHP ou autres); avertissement sur emballage ou point de vente; seuils de minimis applicables","in_force","medium","","","","","Applicable si pansement contient latex naturel ou substances chimiques listées Prop 65; vérifier composition adhésif"
"5","Pansement adhésif","Dispositif médical Cl. I","US-NY","New York","Americas","NY — Federal FDA regulations + State Health Law","21 CFR (federal) + NYS Public Health Law","FDA (federal) + NYS Department of Health","Federal FDA regulations apply; NY State has no additional Class I medical device specific requirements; standard product liability and labeling laws apply","in_force","low","","","","","NY state follows federal FDA framework for Class I medical devices"
