product_id,product_name,product_regime_tag,jurisdiction_code,jurisdiction_name,region,regulation_name,regulation_ref,enforcement_body,key_requirements,status,criticality,legal_api_match,legal_api_id,legal_api_match_method,gap_action,notes
3,Smartphone,Électronique + télécom,GB,United Kingdom,Europe,UK RoHS 2012 (as amended),The Restriction of the Use of Certain Hazardous Substances in EEE Regulations 2012 (SI 2012/3032) + 2019/492,OPSS (Office for Product Safety and Standards),UKCA marking (from Jan 2023); same substance restrictions as EU RoHS 2; technical file; UK DoC,in_force,critical,,,,,Post-Brexit; UKCA replacing CE for UK market
3,Smartphone,Électronique + télécom,GB,United Kingdom,Europe,UK REACH,UK REACH (retained from EU REACH; administered by HSE),HSE (Health and Safety Executive),SVHC notifications; Candidate List obligations (GB Candidate List may diverge from EU); SCIP equivalent,in_force,critical,,,,,GB REACH diverging over time from EU REACH
3,Smartphone,Électronique + télécom,GB,United Kingdom,Europe,UK Radio Equipment Regulations 2017,SI 2017/1206 (Radio Equipment Regulations 2017),Ofcom + OPSS,UKCA marking; radio type compliance; DoC; same essential requirements as RED,in_force,critical,,,,,
3,Smartphone,Électronique + télécom,GB,United Kingdom,Europe,PSTI Act 2022 (Product Security),Product Security and Telecommunications Infrastructure Act 2022,OPSS / DCMS,Minimum IoT/connected product security requirements: no universal default passwords; vulnerability disclosure policy; transparency on security update support period; in force from April 2024,in_force,high,,,,,PSTI came into force 29 April 2024; smartphones explicitly covered
3,Smartphone,Électronique + télécom,GB,United Kingdom,Europe,UK WEEE Regulations,Waste Electrical and Electronic Equipment Regulations 2013 (SI 2013/3113) + 2019/428,Environment Agency + SEPA + NRW,Producer registration; WEEE compliance scheme membership (e.g. Valpak; Recolight); EEE declarations; take-back,in_force,high,,,,,
3,Smartphone,Électronique + télécom,GB,United Kingdom,Europe,UK Battery Regulations,The Batteries and Accumulators (Placing on the Market) Regulations 2008 (SI 2008/2164),Environment Agency,Battery producer registration; collection and recycling obligations; labelling,in_force,high,,,,,
3,Smartphone,Électronique + télécom,CH,Switzerland,Europe,ChemRRV — Chemical Risk Reduction Ordinance,Chemikalien-Risikoreduktions-Verordnung (ChemRRV) SR 814.81,Bundesamt für Umwelt (BAFU),RoHS-equivalent restrictions; aligns with EU RoHS 2; regular alignment updates,in_force,critical,,,,,Switzerland not EU but tracks EU restrictions closely
3,Smartphone,Électronique + télécom,CH,Switzerland,Europe,FMG / VREG — Radio Equipment Ordinance,Verordnung über Radio- und Fernmeldeterminalgeräte (VREG) SR 784.101.2,BAKOM (Bundesamt für Kommunikation),Radio type approval; Swiss conformity; frequency plan compliance; BAKOM mutual recognition with EU RED for some devices,in_force,critical,,,,,
3,Smartphone,Électronique + télécom,CH,Switzerland,Europe,VVEA — E-waste Ordinance,VVEA (Verordnung über die Vermeidung und Entsorgung von Abfällen) SR 814.600,BAFU,Producer registration with SWICO/SENS; advance recycling fee (vRG); collection obligation,in_force,high,,,,,
3,Smartphone,Électronique + télécom,NO,Norway,Europe,Norwegian RoHS (EEA implementation),FOR-2008-06-01-596 (Elektronikkforskriften) — EEA alignment with 2011/65/EU,Miljødirektoratet (Norwegian Environment Agency),Same restrictions as EU RoHS 2; CE mark accepted as Norway is EEA member,in_force,critical,,,,,Norway = EEA; adopts EU directives; no separate Norwegian mark needed
3,Smartphone,Électronique + télécom,NO,Norway,Europe,Norwegian Radio Equipment Regulations,FOR-2016-11-28-1403 — EEA alignment with RED 2014/53/EU,Nasjonal kommunikasjonsmyndighet (Nkom),CE mark; RED essential requirements; Nkom market surveillance,in_force,critical,,,,,
3,Smartphone,Électronique + télécom,NO,Norway,Europe,Norwegian WEEE Regulations,FOR-1998-06-03-432 (EE-avfall-forskriften) — EEA alignment with 2012/19/EU,Miljødirektoratet,Elretur/RENAS producer registration; take-back; collection,in_force,high,,,,,
3,Smartphone,Électronique + télécom,RU,Russia,Europe,EAC TR CU 004/2011 — Low Voltage Safety,TR CU 004/2011,Rosstandart + Rospotrebnadzor,EAC conformity mark; safety of low-voltage equipment; national body certification or declaration,in_force,critical,,,,,EAEU-wide TR; applicable to Russia; Kazakhstan; Belarus; Armenia; Kyrgyzstan
3,Smartphone,Électronique + télécom,RU,Russia,Europe,EAC TR CU 020/2011 — EMC,TR CU 020/2011,Rosstandart,EAC EMC requirements; testing in accredited lab,in_force,critical,,,,,
3,Smartphone,Électronique + télécom,RU,Russia,Europe,Roskomnadzor Radio Type Approval,Federal Law No. 126-FZ (Communications Law) + Roskomnadzor Orders,Roskomnadzor,Frequency assignment and radio certification; separate from EAC; required for each radio module,in_force,critical,,,,,Sanctions context: market access may be restricted; still legally required
3,Smartphone,Électronique + télécom,RU,Russia,Europe,RF Extended Producer Responsibility (ROP),Federal Law No. 89-FZ (Waste Production) + RF Government Resolution 2284,Rosprirodnadzor,Producer responsibility for e-waste; recycling norm 35% by 2024; utilisation fee if not self-recycling,in_force,high,,,,,
3,Smartphone,Électronique + télécom,TR,Turkey,Europe,BTK — Radio Type Approval (TS-EN harmonised),Elektronik Haberleşme Kanunu No. 5809 + BTK Yönetmeliği,Bilgi Teknolojileri ve İletişim Kurumu (BTK),BTK type approval; aligned with RED 2014/53/EU; CE + TR conformity; local importer registration,in_force,critical,,,,,
3,Smartphone,Électronique + télécom,TR,Turkey,Europe,TSE — Turkish Standards Institution Safety,TS EN 62368-1 (safety) + TS EN 55032 (EMC),TSE (Türk Standardları Enstitüsü),TSE/CE conformity; product safety certification; labelling in Turkish,in_force,critical,,,,,
3,Smartphone,Électronique + télécom,TR,Turkey,Europe,Turkish RoHS (AEEE Yönetmeliği),Atık Elektrikli ve Elektronik Eşyaların Kontrolü Yönetmeliği (AEEE) 2012 + 2019 update,Çevre; Şehircilik ve İklim Değişikliği Bakanlığı,RoHS-aligned substance restrictions; e-waste producer registration; AEEE mark; take-back,in_force,high,,,,,Aligns closely with EU RoHS 2 and WEEE
3,Smartphone,Électronique + télécom,TR,Turkey,Europe,KVKK — Personal Data Protection Law,Kişisel Verilerin Korunması Kanunu No. 6698 (2016),KVKK (Kişisel Verilerin Korunması Kurulu),Data processing principles; consent; notification of KVKK for data controllers; cross-border transfer restrictions,in_force,medium,,,,,Smartphone manufacturers processing data of TR users
3,Smartphone,Électronique + télécom,UA,Ukraine,Europe,Ukrainian Technical Regulations — Radio Equipment,Resolution of CMU No. 355 (2017) — aligns with RED 2014/53/EU,Держпродспоживслужба + НКРЗІ (NCEC),Technical regulations aligned with EU RED; conformity mark; NKRZI type approval for radio,in_force,critical,,,,,Ukraine EU association; significant alignment with EU directives
3,Smartphone,Électronique + télécom,UA,Ukraine,Europe,Ukrainian RoHS Regulation,Resolution of CMU No. 142 (2013) (aligned with RoHS 2),Держпродспоживслужба,Hazardous substance restrictions; labelling; market surveillance,in_force,high,,,,,
3,Smartphone,Électronique + télécom,UA,Ukraine,Europe,Ukrainian WEEE Regulation,Law of Ukraine No. 187-IX (2019) on Waste Management,Ministry of Environment Ukraine,Producer responsibility; take-back; e-waste classification,in_force,medium,,,,,Implementation disrupted by conflict 2022-2024
3,Smartphone,Électronique + télécom,EAEU,EAEU,Europe,EAC TR CU 004/2011 — Low Voltage Safety,TR CU 004/2011,EEC (Eurasian Economic Commission),Common safety requirements; EAC mark; declaration or certification by accredited body; covers RU; KZ; BY; AM; KG,in_force,critical,,,,,
3,Smartphone,Électronique + télécom,EAEU,EAEU,Europe,EAC TR CU 020/2011 — EMC,TR CU 020/2011,EEC,Electromagnetic compatibility; EAC mark,in_force,critical,,,,,
3,Smartphone,Électronique + télécom,EAEU,EAEU,Europe,EAC TR EAEU 037/2016 — RoHS equivalent,TR EAEU 037/2016,EEC,Restriction of hazardous substances aligned with EU RoHS 2; EAC mark; DoC,in_force,high,,,,,Applied across EAEU bloc
3,Smartphone,Électronique + télécom,US,United States,Americas,FCC Part 15 — Unintentional Radiators,47 CFR Part 15,Federal Communications Commission (FCC),FCC ID marking; SDoC or certification; EMI/EMC limits for digital devices; testing in accredited lab,in_force,critical,,,,,
3,Smartphone,Électronique + télécom,US,United States,Americas,FCC Part 22/24/27 — Cellular/PCS/AWS Radio,47 CFR Parts 22; 24; 27,FCC,Type acceptance for cellular; PCS; AWS; LTE; 5G bands; FCC ID required; SAR testing per FCC OET 65,in_force,critical,,,,,All smartphones need FCC ID for US market
3,Smartphone,Électronique + télécom,US,United States,Americas,FCC SAR Limits — RF Exposure,FCC OET Bulletin 65 + 47 CFR 2.1091,FCC OET (Office of Engineering and Technology),SAR limit 1.6 W/kg averaged over 1g tissue; testing per IEEE 1528; disclosure in user manual,in_force,critical,,,,,
3,Smartphone,Électronique + télécom,US,United States,Americas,CPSC GCC — General Conformity Certificate,Consumer Product Safety Improvement Act (CPSIA) 15 U.S.C. 2063,CPSC (Consumer Product Safety Commission),GCC required for children's products and specified consumer products; testing; recordkeeping,in_force,high,,,,,
3,Smartphone,Électronique + télécom,US,United States,Americas,Dodd-Frank Section 1502 — Conflict Minerals,Dodd-Frank Wall Street Reform Act Section 1502 + SEC Rule 13p-1,SEC (Securities and Exchange Commission),Annual disclosure (Form SD) if company listed on US exchange; due diligence on 3TG from DRC conflict region; RCOI survey,in_force,medium,,,,,Applies to publicly-listed companies; supply chain due diligence for smartphone manufacturers
3,Smartphone,Électronique + télécom,US,United States,Americas,E-Waste — State-level WEEE (25 states),Various state laws (e.g. CA E-Waste Recycling Act SB 20/50; NY Electronic Equipment Recycling Law),State EPAs,Producer registration; e-waste fees; take-back obligations; varies by state,in_force,high,,,,,No federal e-waste law; California; New York; Texas etc. have state laws
3,Smartphone,Électronique + télécom,US-CA,California,Americas,California Proposition 65,Health and Safety Code Section 25249.5 et seq. (Safe Drinking Water and Toxic Enforcement Act),CalEPA / OEHHA / AG,Warning labels if product exposes consumers to listed chemicals above NSRL/MADL; 900+ chemicals listed; applies to Pb; Cd; phthalates in device,in_force,high,,,,,
3,Smartphone,Électronique + télécom,US-CA,California,Americas,CCPA / CPRA — Consumer Privacy Rights,California Consumer Privacy Act (AB 375) + California Privacy Rights Act (Prop 24),California Privacy Protection Agency (CPPA),Privacy rights for CA consumers; opt-out of data sales; sensitive data restrictions; applicable to device data collection; biometric data,in_force,high,,,,,
3,Smartphone,Électronique + télécom,US-CA,California,Americas,SB-327 — IoT Security Law,California SB-327 (codified in Civil Code Section 1798.91.04),CA AG (Attorney General),Connected devices must have reasonable security features; unique default passwords or force password change on first use; in force since Jan 2020,in_force,high,,,,,First IoT security law in US; smartphones explicitly covered
3,Smartphone,Électronique + télécom,US-CA,California,Americas,California E-Waste Recycling Act,SB 20 / SB 50 (Public Resources Code Section 42464.4 et seq.),CalRecycle,Covered Electronic Waste (CEW) recycling fee at point of sale; manufacturer registration; approved collectors,in_force,high,,,,,
3,Smartphone,Électronique + télécom,US-NY,New York,Americas,SHIELD Act — Data Security,Stop Hacks and Improve Electronic Data Security Act (NY General Business Law Section 899-bb),NY AG,Reasonable data security program for devices processing NY residents private data; breach notification; applies to smartphone manufacturers collecting personal data,in_force,high,,,,,
3,Smartphone,Électronique + télécom,US-NY,New York,Americas,NY Electronic Equipment Recycling Act,NY Environmental Conservation Law Section 27-2601 et seq.,NY DEC (Dept. of Environmental Conservation),Manufacturer registration; e-waste take-back programs; manufacturer recycling targets; labelling,in_force,high,,,,,
3,Smartphone,Électronique + télécom,CA,Canada,Americas,ISED RSS Standards — Radio Certification,RSS-102 (RF exposure) + RSS-132 (cellular) + RSS-247 (WiFi/BT) + others,ISED Canada (Innovation; Science and Economic Development),ISED certification (IC ID); RSS standards compliance; SAR limit 1.6 W/kg (1g); test reports from accredited lab,in_force,critical,,,,,
3,Smartphone,Électronique + télécom,CA,Canada,Americas,CSA C22.2 No. 62368-1 — Electrical Safety,CSA C22.2 No. 62368-1-14 (Audio/Video/IT Equipment Safety),CSA Group + SCC (Standards Council of Canada),Electrical safety certification; CSA mark or cUL mark; based on IEC 62368-1,in_force,critical,,,,,
3,Smartphone,Électronique + télécom,CA,Canada,Americas,Canadian ICES-003 — Digital Apparatus EMC,ICES-003 Issue 7 (2020),ISED Canada,Class B digital apparatus EMC limits; ICES-003 compliance; SDoC or certification,in_force,critical,,,,,
3,Smartphone,Électronique + télécom,CA,Canada,Americas,CEPA — Canadian Environmental Protection Act,Canadian Environmental Protection Act 1999 (S.C. 1999; c. 33),Environment and Climate Change Canada (ECCC),Restriction of toxic substances; SVHC-equivalent assessments; DSL/NDSL lists,in_force,high,,,,,
3,Smartphone,Électronique + télécom,CA,Canada,Americas,Canada E-Waste / EPRA — Provincial Programs,Provincial programs (EPRA — Electronic Products Recycling Association) in AB; BC; MB; SK; ON; QC etc.,Province-level environment ministries,Producer registration per province; e-waste fee; take-back; varies by province,in_force,high,,,,,No national federal e-waste law; provincial patchwork
3,Smartphone,Électronique + télécom,CA,Canada,Americas,PIPEDA / Bill C-27 (Privacy),Personal Information Protection and Electronic Documents Act (PIPEDA) S.C. 2000 c. 5,Office of the Privacy Commissioner of Canada (OPC),Privacy obligations for commercial collection of personal data from device; consent; breach notification (since Nov 2018),in_force,medium,,,,,Bill C-27 (CPPA) to replace PIPEDA; still in Parliament as of 2024
3,Smartphone,Électronique + télécom,MX,Mexico,Americas,IFETEL — Homologación telecomunicaciones,Ley Federal de Telecomunicaciones y Radiodifusión Art. 72 + NOM-087-SCT1,IFT (Instituto Federal de Telecomunicaciones),Mandatory homologation before sale; IFT type approval; radio frequency compliance; IFT mark,in_force,critical,,,,,
3,Smartphone,Électronique + télécom,MX,Mexico,Americas,NOM-024-SCFI-2013 — Safety of IT Equipment,NOM-024-SCFI-2013 (based on IEC 62368-1),SE (Secretaría de Economía) + PROFECO,Safety labelling; NOM certification; importer/manufacturer registration; testing by accredited lab,in_force,critical,,,,,
3,Smartphone,Électronique + télécom,MX,Mexico,Americas,NOM-019-SCFI — EMC for EEE,NOM-019-SCFI-1998 + NOM-003-SCFI-2014,SE + PROFECO,EMC limits; NOM mark; tested in Mexico-accredited or mutually recognised lab,in_force,high,,,,,
3,Smartphone,Électronique + télécom,MX,Mexico,Americas,LGPIRS / Ley RESA — E-Waste MX,Ley General para la Prevención y Gestión Integral de los Residuos (LGPIRS) + NOM-161-SEMARNAT-2011,SEMARNAT (Secretaría de Medio Ambiente y Recursos Naturales),Classification of e-waste as special management waste; producer responsibility plan; authorised waste handlers,in_force,medium,,,,,
3,Smartphone,Électronique + télécom,MX,Mexico,Americas,LFPDPPP — Data Privacy MX,Ley Federal de Protección de Datos Personales en Posesión de los Particulares (2010),INAI (Instituto Nacional de Transparencia),Privacy notice; consent; data subject rights; applies to data collected via smartphones from MX users,in_force,medium,,,,,
3,Smartphone,Électronique + télécom,BR,Brazil,Americas,ANATEL — Homologação,Lei Geral de Telecomunicações 9.472/1997 + Resolução ANATEL 715/2019,ANATEL (Agência Nacional de Telecomunicações),Mandatory homologation of all radio-frequency equipment; ANATEL certification label; testing by ANATEL-accredited lab; OTA/SAR requirements,in_force,critical,,,,,
3,Smartphone,Électronique + télécom,BR,Brazil,Americas,INMETRO Certification — Safety,Portaria INMETRO 170/2012 + NM 326 (safety of EEE),INMETRO (Instituto Nacional de Metrologia),Compulsory certification (SBAC scheme); INMETRO mark; accredited lab testing; safety per IEC 62368-1,in_force,high,,,,,
3,Smartphone,Électronique + télécom,BR,Brazil,Americas,CONMETRO RoHS — Restriction Substances BR,Resolução CONMETRO 002/2017 + Portaria INMETRO 025/2021,INMETRO + MMA (Ministério do Meio Ambiente),Restriction of hazardous substances aligned with EU RoHS 2; declaration of conformity; phased implementation,in_force,high,,,,,
3,Smartphone,Électronique + télécom,BR,Brazil,Americas,PNRS — Política Nacional Resíduos Sólidos (REEE),Lei 12.305/2010 (PNRS) + Acordo Setorial REEE,MMA + Ministério do Desenvolvimento,Reverse logistics for e-waste (REEE); producer responsibility; collection points; sectoral agreement participation,in_force,high,,,,,
3,Smartphone,Électronique + télécom,BR,Brazil,Americas,LGPD — Lei Geral de Proteção de Dados,Lei 13.709/2018 (LGPD),ANPD (Autoridade Nacional de Proteção de Dados),Data processing principles; consent; data subject rights; breach notification; DPO appointment; applies to smartphone data processing,in_force,high,,,,,
3,Smartphone,Électronique + télécom,AR,Argentina,Americas,ENACOM — Radio Homologación,Resolución ENACOM 1523/2016 + Disposición 1201,ENACOM (Ente Nacional de Comunicaciones),Radio homologation; ENACOM ID; frequency compliance,in_force,critical,,,,,
3,Smartphone,Électronique + télécom,AR,Argentina,Americas,IRAM / Resolución SC 92/1998 — Safety,Resolución SC 92/1998 + IRAM IEC 62368-1,Secretaría de Comercio + INTI,Product safety certification; IRAM or SIM mark; accredited testing,in_force,high,,,,,
3,Smartphone,Électronique + télécom,AR,Argentina,Americas,Ley 25.675 — Residuos Electrónicos,Ley 25.675 (Ley General del Ambiente) + provincial RAEE laws,Ministerio de Ambiente + CONICET,E-waste management; some provinces (Buenos Aires; Córdoba) have specific RAEE regulations,in_force,medium,,,,,National framework; implementation patchy by province
3,Smartphone,Électronique + télécom,CL,Chile,Americas,SUBTEL — Homologación Radio,DFL MOP 1/1994 (Ley General de Telecomunicaciones) + Resolución SUBTEL 1006,SUBTEL (Subsecretaría de Telecomunicaciones),Mandatory radio type homologation; SUBTEL certificate; SAR testing,in_force,critical,,,,,
3,Smartphone,Électronique + télécom,CL,Chile,Americas,SEC — Electrical Safety Certification,Ley 18.410 + Resolución SEC 228,SEC (Superintendencia de Electricidad y Combustibles),Electrical safety certificate; importer responsibility; IEC 62368-1 basis,in_force,high,,,,,
3,Smartphone,Électronique + télécom,CL,Chile,Americas,Ley 20.920 — Ley REP (RAEE),Ley 20.920 (2016) + DS No. 8/2021 (reglamento RAEE),Ministerio del Medio Ambiente,Producer registration; take-back obligations; collection targets for RAEE; since 2023,in_force,high,,,,,Chile REP law; first compliance obligations 2023-2024
3,Smartphone,Électronique + télécom,CO,Colombia,Americas,MINTIC / CRC — Homologación Radio,Ley 1341/2009 + Resolución CRC 3870/2008,CRC (Comisión de Regulación de Comunicaciones) + MinTIC + ANE,Radio type approval (homologación) via MINTIC; ANE frequency compliance,in_force,critical,,,,,
3,Smartphone,Électronique + télécom,CO,Colombia,Americas,ICONTEC / NTC — Safety,NTC-IEC 62368-1 (based on IEC standard),SIC (Superintendencia de Industria y Comercio),Safety conformity; ICONTEC certification or equivalent; importer responsibility,in_force,high,,,,,
3,Smartphone,Électronique + télécom,CO,Colombia,Americas,Decreto 284/2018 — RAEE Colombia,Decreto 284/2018 + Resolución MADS 1297/2010,Ministerio de Ambiente y Desarrollo Sostenible (MADS),E-waste producer extended responsibility; collection targets; authorised managers,in_force,medium,,,,,
3,Smartphone,Électronique + télécom,MERCOSUR,Mercosur,Americas,MERCOSUR Technical Regulation — EEE Safety,GMC/RES No. 56/92 + CMC/DEC No. 24/10,Comisión de Comercio del MERCOSUR (CCM),Harmonised product safety framework for EEE in Argentina; Brazil; Paraguay; Uruguay; national implementation,in_force,medium,,,,,High-level framework; national authorities still have primary role
3,Smartphone,Électronique + télécom,MERCOSUR,Mercosur,Americas,MERCOSUR EMC Framework,MERCOSUR NM 326 (based on CISPR standards),CCM,EMC limits framework for bloc; implemented nationally,in_force,medium,,,,,
3,Smartphone,Électronique + télécom,CN,China,Asia-Pacific,CCC — China Compulsory Certification,Decree AQSIQ 117/2009 (3C Catalogue) + CCC Technical Requirements,SAMR (State Administration for Market Regulation) + CQC / CNCA,Mandatory CCC mark; factory inspection; type testing in CNAS-accredited lab; annual surveillance; covers safety + EMC,in_force,critical,,,,,Smartphones explicitly in 3C compulsory category (Category 16)
3,Smartphone,Électronique + télécom,CN,China,Asia-Pacific,SRRC — Radio Type Approval,SRRC Administrative Regulations (MIIT Order No. 52; 2016),SRRC (State Radio Regulation Commission) / MIIT,Radio type approval; SRRC ID printed on device; covers WiFi; BT; NFC; cellular; separate from CCC,in_force,critical,,,,,
3,Smartphone,Électronique + télécom,CN,China,Asia-Pacific,CMIIT — Network Access License (NAL),MIIT Regulation on Administration of Radio Stations + Telecom Equipment Network Access,CMIIT / MIIT,Network Access License for telecommunications terminal equipment; connected device NAL; CMIIT ID,in_force,critical,,,,,Mandatory for any device connecting to public telecom network in CN
3,Smartphone,Électronique + télécom,CN,China,Asia-Pacific,GB 4943.1 — IT Equipment Safety,GB 4943.1-2022 (aligned with IEC 62368-1),SAMR,Safety standard for audio/video/IT equipment; basis for CCC testing,in_force,high,,,,,
3,Smartphone,Électronique + télécom,CN,China,Asia-Pacific,GB/T 9254 — EMC (CISPR 32 equivalent),GB/T 9254.1-2021 + GB/T 9254.2-2021,SAMR,EMC emissions limits for multimedia equipment; part of CCC scope,in_force,high,,,,,
3,Smartphone,Électronique + télécom,CN,China,Asia-Pacific,China RoHS — Restriction of Hazardous Substances in EEE,Order No. 32 (2016) — Management Methods for Restriction of Use of Hazardous Substances in EEE (Revised),MIIT + MEE,China RoHS Table (Annex I/II); SJ/T 11364-2014 labelling (orange diamond / green logo); Phase II disclosure requirements,in_force,critical,,,,,China RoHS Phase II different from EU RoHS in some respects
3,Smartphone,Électronique + télécom,CN,China,Asia-Pacific,WEEE — Administrative Measures on Recovery and Disposal of Waste EEE,Order No. 551/2011 (WEEE Regulations) + 2019 Amendment,MEE (Ministry of Ecology and Environment),Producer responsibility fund; registration; take-back fund contribution; 14 categories including mobile phones,in_force,high,,,,,
3,Smartphone,Électronique + télécom,CN,China,Asia-Pacific,MLPS 2.0 / Cybersecurity Law / PIPL,Cybersecurity Law 2017 + Data Security Law 2021 + PIPL 2021 + MLPS 2.0 (GB/T 22239-2019),CAC (Cyberspace Administration of China) + MIIT + MPS,Data localisation; MLPS grading for connected products; security assessment for cross-border data transfer; PIPL compliance for smartphone data,in_force,high,,,,,Multiple laws apply; PIPL enforced since Nov 2021
3,Smartphone,Électronique + télécom,CN,China,Asia-Pacific,GB 21288 — SAR Limits,GB 21288-2022 (Mobile phone SAR limits),MIIT + SAMR,SAR limit 2.0 W/kg averaged over 10g tissue (ICNIRP aligned); mandatory test and declaration,in_force,high,,,,,
3,Smartphone,Électronique + télécom,HK,Hong Kong,Asia-Pacific,OFCA Type Approval — Radio,Telecommunications Ordinance (Cap. 106) + OFCA TA programme,OFCA (Office of the Communications Authority),Type Approval Certificate for radio equipment; frequency compliance; display of TA number,in_force,critical,,,,,
3,Smartphone,Électronique + télécom,HK,Hong Kong,Asia-Pacific,Electrical Products (Safety) Regulation,Cap. 406G — Electrical Products (Safety) Regulation,EMSD (Electrical and Mechanical Services Department),Electrical safety requirements; EMSD approval or supplier declaration; compliant with IEC 62368-1,in_force,critical,,,,,
3,Smartphone,Électronique + télécom,HK,Hong Kong,Asia-Pacific,PDPO — Personal Data (Privacy) Ordinance,Cap. 486 — Personal Data (Privacy) Ordinance + 2021 Amendments,PCPD (Privacy Commissioner for Personal Data),Data collection limitation; data use limitation; data security; erasure; applies to data processed via HK-sold devices,in_force,medium,,,,,
3,Smartphone,Électronique + télécom,TW,Taiwan,Asia-Pacific,NCC — Radio Type Approval,Telecommunications Management Act (2019) + NCC Type Approval Regulations,NCC (National Communications Commission),Mandatory NCC type approval; NCC ID on device; BSMI+NCC co-approval possible,in_force,critical,,,,,
3,Smartphone,Électronique + télécom,TW,Taiwan,Asia-Pacific,BSMI — Commodity Inspection,Commodity Inspection Act + Enforcement Rules,BSMI (Bureau of Standards; Metrology and Inspection),Compulsory certification (safety + EMC); BSMI Registration Number; 3rd-party lab testing,in_force,critical,,,,,
